{
  "$schema": "http://json-schema.org/draft-07/schema#",
  "title": "Protokoll",
  "description": "Mötesprotokoll / Meeting minutes",
  "type": "object",
  "required": ["meeting_type", "date", "attendees", "agenda_items"],
  "properties": {
    "page_template": {
      "description": "Sidmall som två oberoende delar: header (sidhuvud) och footer (sidfot). Varje del är en variant, ett objekt med uppgifter, eller null för tomt. Namnet är ett alias för en färdig kombination.",
      "default": "formal",
      "oneOf": [
        {
          "type": "string",
          "enum": [
            "formal",
            "clean",
            "none"
          ],
          "description": "Alias för en kombination av sidhuvud och sidfot: 'formal' (letterhead + standard med dokumenttiteln i sidfoten), 'clean' (logo + standard) eller 'none' (tomt sidhuvud + standard)."
        },
        {
          "type": "object",
          "additionalProperties": false,
          "properties": {
            "name": {
              "type": "string",
              "enum": [
                "formal",
                "clean",
                "none"
              ],
              "description": "Alias för en kombination av sidhuvud och sidfot: formal = letterhead + standard med dokumenttiteln i sidfoten, clean = logo + standard, none = tomt sidhuvud + standard. Ett header- eller footer-värde bredvid aliaset ersätter den sidan av kombinationen."
            },
            "page_numbers": {
              "type": "boolean",
              "description": "Visa sidnummer i sidfoten"
            },
            "first_page_header": {
              "type": "boolean",
              "description": "Visa sidhuvud på första sidan"
            },
            "font": {
              "type": "string",
              "description": "Dokumentets typsnitt (fontspec-namn, t.ex. 'Futura'). Måste finnas installerat där renderingen sker."
            },
            "header_font": {
              "type": "string",
              "description": "Typsnitt för sidhuvud och sidfot. Default: samma som font."
            },
            "diff_style": {
              "type": "string",
              "enum": [
                "color",
                "underline"
              ],
              "default": "color",
              "description": "Hur tillagd text markeras: \"color\" (grön text, default) eller \"underline\" (grön understruken — konventionen i ändringsdokument, och den signal som överlever svartvit utskrift). Struken text är överstruken i båda fallen."
            },
            "header": {
              "description": "Sidhuvudets innehåll: null för tomt sidhuvud, ett variantnamn, eller ett objekt med variant och uppgifterna som ska stå där.",
              "oneOf": [
                {
                  "type": "null",
                  "description": "Tomt sidhuvud — inget skrivs överst på sidan."
                },
                {
                  "type": "string",
                  "enum": [
                    "letterhead",
                    "logo"
                  ],
                  "description": "Sidhuvudsvariant utan uppgifter: 'letterhead' (organisationsuppgifter till vänster, logotyp till höger) eller 'logo' (endast logotyp till höger)."
                },
                {
                  "type": "object",
                  "description": "Organisationsuppgifter till vänster och logotyp till höger. Utelämnade uppgifter skrivs inte ut; utan uppgifter och logotyp återtas sidhuvudets utrymme.",
                  "required": [
                    "variant"
                  ],
                  "additionalProperties": false,
                  "properties": {
                    "variant": {
                      "const": "letterhead"
                    },
                    "org_name": {
                      "type": "string",
                      "description": "Organisationens namn, i fetstil överst till vänster."
                    },
                    "address": {
                      "type": "string",
                      "description": "Postadress, under organisationsnamnet."
                    },
                    "web": {
                      "type": "string",
                      "description": "Webbplats, i sidhuvudets högra textkolumn."
                    },
                    "email": {
                      "type": "string",
                      "description": "E-postadress, i sidhuvudets högra textkolumn."
                    },
                    "phone": {
                      "type": "string",
                      "description": "Telefonnummer, i sidhuvudets högra textkolumn."
                    },
                    "logo": {
                      "type": "string",
                      "description": "Filnamn för logotypen längst upp till höger i sidhuvudet. Filnamnet får inte innehålla LaTeX-specialtecken (t.ex. _ eller &) och letas upp i asset_dir eller arbetskatalogen."
                    }
                  }
                },
                {
                  "type": "object",
                  "description": "Endast logotyp till höger i sidhuvudet. Utan logotyp återtas sidhuvudets utrymme.",
                  "required": [
                    "variant"
                  ],
                  "additionalProperties": false,
                  "properties": {
                    "variant": {
                      "const": "logo"
                    },
                    "logo": {
                      "type": "string",
                      "description": "Filnamn för logotypen längst upp till höger i sidhuvudet. Filnamnet får inte innehålla LaTeX-specialtecken (t.ex. _ eller &) och letas upp i asset_dir eller arbetskatalogen."
                    }
                  }
                }
              ]
            },
            "footer": {
              "description": "Sidfotens innehåll: null för tom sidfot, 'standard' för sidnummerraden, eller ett objekt med uppgifterna som ska stå där.",
              "oneOf": [
                {
                  "type": "null",
                  "description": "Tom sidfot — inget skrivs längst ned på sidan."
                },
                {
                  "type": "string",
                  "enum": [
                    "standard"
                  ],
                  "description": "Sidnummer centrerat i sidfoten."
                },
                {
                  "type": "object",
                  "additionalProperties": false,
                  "description": "Sidfotens innehåll. Med kontaktuppgifter blir sidfoten en flerkolumnsfot med företags-, kontakt- och betalningsuppgifter; utan dem står bara sidnumret centrerat.",
                  "properties": {
                    "variant": {
                      "type": "string",
                      "enum": [
                        "standard"
                      ],
                      "description": "Sidfotsvariant. Enda varianten är 'standard'."
                    },
                    "title": {
                      "type": "boolean",
                      "default": false,
                      "description": "true skriver dokumenttiteln före sidnumret i sidfoten. Gäller endast sidnummerraden, inte kontaktuppgiftsfoten."
                    },
                    "company": {
                      "type": "string",
                      "description": "Företagsnamn"
                    },
                    "address": {
                      "oneOf": [
                        {
                          "type": "string"
                        },
                        {
                          "type": "array",
                          "items": {
                            "type": "string"
                          }
                        }
                      ],
                      "description": "Postadress som array med en rad per element, t.ex. ['Storgatan 1', '123 45 Stad'] — radbryts som en postadress. En sträng renderas som en enda rad."
                    },
                    "seat": {
                      "type": "string",
                      "description": "Styrelsens säte, t.ex. 'Malmö'"
                    },
                    "org_number": {
                      "type": "string",
                      "description": "Organisationsnummer"
                    },
                    "vat_number": {
                      "type": "string",
                      "description": "Momsregistreringsnummer (SExxxxxxxxxx01)"
                    },
                    "f_tax": {
                      "type": "boolean",
                      "description": "true visar raden 'Godkänd för F-skatt'"
                    },
                    "phone": {
                      "type": "string",
                      "description": "Telefon"
                    },
                    "email": {
                      "type": "string",
                      "description": "E-post"
                    },
                    "web": {
                      "type": "string",
                      "description": "Webbplats"
                    },
                    "bankgiro": {
                      "type": "string"
                    },
                    "plusgiro": {
                      "type": "string"
                    },
                    "iban": {
                      "type": "string"
                    },
                    "bic": {
                      "type": "string"
                    }
                  }
                }
              ]
            }
          }
        }
      ]
    },
    "meeting_type": {
      "type": "string",
      "description": "Type of meeting, e.g. Styrelsemöte, Årsmöte"
    },
    "meeting_number": {
      "type": "string",
      "description": "Meeting number, e.g. 3/2026"
    },
    "date": {
      "type": "string",
      "description": "Meeting date (YYYY-MM-DD)"
    },
    "time_start": {
      "type": "string",
      "description": "Start time, e.g. 18:00"
    },
    "time_end": {
      "type": "string",
      "description": "End time, e.g. 19:30"
    },
    "location": {
      "type": "string"
    },
    "chair": {
      "type": "string",
      "description": "Meeting chair / Ordförande"
    },
    "secretary": {
      "type": "string",
      "description": "Secretary / Sekreterare"
    },
    "adjusters": {
      "type": "array",
      "items": { "type": "string" },
      "description": "Justerare"
    },
    "attendees": {
      "type": "array",
      "items": { "type": "string" },
      "minItems": 1
    },
    "agenda_items": {
      "type": "array",
      "items": {
        "type": "object",
        "required": ["title"],
        "properties": {
          "title": { "type": "string", "description": "Punktens rubrik. Inline-markup gäller: **fet**, *kursiv*, `kod`, \"citat\", samt ändringsmarkering {+tillagd text+} (grön) och [-struken text-] (röd genomstruken). Radbrytning blir radbrytning." },
          "discussion": { "type": "string", "description": "Diskussionstext. Inline-markup gäller: **fet**, *kursiv*, `kod`, \"citat\", samt ändringsmarkering {+tillagd text+} (grön) och [-struken text-] (röd genomstruken). Radbrytning blir radbrytning." },
          "decision": { "type": "string", "description": "Beslutstext. Inline-markup gäller: **fet**, *kursiv*, `kod`, \"citat\", samt ändringsmarkering {+tillagd text+} (grön) och [-struken text-] (röd genomstruken). Radbrytning blir radbrytning." },
          "subItems": {
            "type": "array",
            "items": { "type": "string" },
            "description": "Valfria underpunkter, numrerade decimalt under punkten (1.1., 1.2., …) och renderade efter punktens diskussion och beslut. Inline-markup gäller: **fet**, *kursiv*, `kod`, \"citat\", samt ändringsmarkering {+tillagd text+} (grön) och [-struken text-] (röd genomstruken). Radbrytning blir radbrytning."
          }
        }
      },
      "minItems": 1
    }
  }
}
